{
  "ended_at_utc": "2026-02-28T15:18:44Z",
  "errors": [],
  "inputs": {
    "brick_size": 64,
    "dims": [
      128,
      128,
      128
    ],
    "dtype": "f32",
    "in_dir": "C:\\Users\\soma\\projects\\print-organizer\\examples\\linked-torus\\out/linked-torus",
    "manifest_path": "C:\\Users\\soma\\projects\\print-organizer\\examples\\linked-torus\\out/linked-torus\\manifest.json",
    "voxel_size": 1.0
  },
  "schema_version": 1,
  "stage": "write",
  "started_at_utc": "2026-02-28T15:18:43Z",
  "stats": {
    "aabb_max": [
      64.0,
      64.0,
      64.0
    ],
    "aabb_min": [
      -64.0,
      -64.0,
      -64.0
    ],
    "active_voxel_count": 2097152,
    "brick_count": 8,
    "degenerate_count": 0,
    "mesh_aabb_max": [
      63.130279541015625,
      63.130279541015625,
      63.130279541015625
    ],
    "mesh_aabb_min": [
      -64.13027954101563,
      -64.13027954101563,
      -64.13027954101563
    ],
    "quad_count": 332520,
    "triangle_count": 665040,
    "vertex_count": 332418
  },
  "status": "success",
  "timing_ms": {
    "meshing": 465.2819,
    "read": 13.4074,
    "total": 1602.2399,
    "validate": 0.533,
    "vdb_build": 236.582,
    "write": 870.3254
  },
  "warnings": []
}
